{
  "id": "workflow_action_example_001",
  "workspaceId": "workspace_example_001",
  "workflowRunId": "workflow_run_example_001",
  "type": "review-resolution",
  "status": "pending",
  "targetObjectId": "review_example_001",
  "label": "Resolve review feedback for context_pack_example_001",
  "owner": "operator@example.local",
  "createdAt": "2026-07-18"
}
